{
  "contract_name": "ToolContext",
  "contract_version": "1.0.0",
  "message_id": "msg-protocol-1",
  "correlation_id": "corr-protocol-1",
  "trace_id": "trace-protocol-1",
  "created_at": "2026-08-18T00:00:00Z",
  "producer": "python-runtime-smoke",
  "capability_id": "engineering.synthetic.runtime_smoke",
  "capability_version": "0.0.1"
}
